{
  "id": "00000000-0000-0000-0000-000000000911",
  "schema_version": "webhook-endpoint/v1",
  "tenant_id": "00000000-0000-0000-0000-000000000001",
  "display_name": "Security Operations Slack",
  "destination_type": "slack",
  "endpoint_url_ref": "00000000-0000-0000-0000-000000000922",
  "destination_host": "hooks.slack.com",
  "enabled": false,
  "event_types": ["critical_detection.created", "policy_violation.detected"],
  "payload_version": "webhook-event/v1",
  "signing_algorithm": "hmac-sha256",
  "signing_secret_ref": "00000000-0000-0000-0000-000000000921",
  "region": "us-central1",
  "retry_policy": {
    "max_attempts": 5,
    "initial_backoff_seconds": 30,
    "max_backoff_seconds": 1800
  },
  "created_by": "platform-admin@example.com",
  "created_at": "2026-05-18T18:10:00Z",
  "updated_at": "2026-05-18T18:10:00Z"
}